{
  "header": {
    "name": "Mohammed Shehzad Khan",
    "title": "International Primary Educator | Primary EAL & Multilingual Learning | Curriculum, Assessment & Teacher Development",
    "subtitle": "International Primary Educator | Primary EAL & Multilingual Learning | Curriculum, Assessment & Teacher Development"
  },
  "summary": [
    "Primary Educator & EAL Specialist with 11+ years in international settings (China, India). I specialize in rapidly improving academic English outcomes for multilingual cohorts by integrating explicit language instruction into inquiry-based science and mathematics through cross-curricular STEM facilitation. Proven track record in mentoring teaching teams to elevate instructional quality school-wide."
  ],
  "competencies": [
    "Teacher mentoring",
    "Instructional quality assurance",
    "Grade 5 writing moderation",
    "Academic language acquisition & Phonics",
    "Early-years immersion",
    "Inquiry-based learning & Cross-curricular STEM",
    "Cross-cultural training",
    "Google Workspace",
    "Microsoft 365",
    "Moodle",
    "Canvas",
    "Zoom",
    "OBS Studio",
    "Primary EAL",
    "Multilingual Education",
    "Curriculum Design",
    "Differentiated Instruction",
    "Formative Assessment",
    "Literacy Development",
    "Classroom Management",
    "Assessment Moderation",
    "Teacher Mentoring",
    "Professional Development",
    "Instructional Quality Assurance",
    "Cross-Curricular STEM",
    "Dialogic Teaching",
    "Questioning Strategies",
    "Translanguaging"
  ],
  "experience": [
    {
      "id": "EMP-2006",
      "role_title": "EAL / English Teacher",
      "employer_name": "Aoxin International School",
      "date_range": "Feb 2024 - Jul 2026",
      "highlights": []
    },
    {
      "id": "EMP-2005",
      "role_title": "Training and Quality Lead",
      "employer_name": "GEDU Global Education",
      "date_range": "Sep 2022 - Aug 2023",
      "highlights": [
        "CLAIM-1002"
      ]
    },
    {
      "id": "EMP-2004",
      "role_title": "Assistant Manager \u2014 Teacher Quality & Development",
      "employer_name": "WhiteHat Jr",
      "date_range": "Aug 2020 - Jul 2022",
      "highlights": [
        "CLAIM-1001"
      ]
    },
    {
      "id": "EMP-2003",
      "role_title": "EAL / English Teacher",
      "employer_name": "Aoxin International School",
      "date_range": "Jul 2018 - Aug 2020",
      "highlights": [
        "CLAIM-1003"
      ]
    },
    {
      "id": "EMP-2002",
      "role_title": "ESL Teacher and Teacher Trainer",
      "employer_name": "Eton House Kindergarten",
      "date_range": "Aug 2017 - Jun 2018",
      "highlights": []
    },
    {
      "id": "EMP-2001",
      "role_title": "ESL Teacher",
      "employer_name": "Helen China TEFL Network",
      "date_range": "Nov 2016 - Aug 2017",
      "highlights": []
    },
    {
      "id": "EMP-2000",
      "role_title": "English, Science and Mathematics Teacher",
      "employer_name": "Scholars Academy",
      "date_range": "Jan 2014 - Nov 2016",
      "highlights": []
    }
  ],
  "education": [
    {
      "id": "QUAL-3000",
      "degree_name": "Bachelor of Science, Physics (B.Sc.)",
      "institution_name": "University of Mumbai",
      "date_range": "2004 - 2007",
      "details": ""
    },
    {
      "id": "QUAL-3001",
      "degree_name": "Master of Arts, English Language and Literature (M.A.)",
      "institution_name": "Harris University",
      "date_range": "2007 - 2009",
      "details": ""
    },
    {
      "id": "QUAL-3002",
      "degree_name": "Postgraduate Certificate in Education (PGCE, non-QTS)",
      "institution_name": "University of Cumbria",
      "date_range": "Sep 2025 - Jul 2026",
      "details": ""
    },
    {
      "id": "QUAL-3003",
      "degree_name": "Bachelor of Education (B.Ed.)",
      "institution_name": "University of Kashmir",
      "date_range": "Oct 2021 - Mar 2024",
      "details": ""
    }
  ],
  "_meta": {
    "schema_version": "1.0",
    "producer_version": "1.0",
    "generator": "project_cv_vm.py"
  }
}